{
  "$schema":"capability.connection.v4.schema.json","schemaVersion":4,"collectorId":"capability.connection","collectorVersion":4,
  "displayName":"SQL Server capability and connection v4","operationalMode":"passive",
  "supportedTargets":{"product":"Microsoft SQL Server","minimumMajorVersion":15,"maximumMajorVersion":17,"platforms":["Windows"],"engineEditions":[2,3,4]},
  "requiredCapabilities":["connection.tds","authentication.windows-integrated","transport.tls-validated","privilege.non-sysadmin","platform.windows"],
  "features":["feature.replication","feature.host-binding"],
  "requiredPermissionsByMajor":{"15":["server.view-state"],"16":["server.view-performance-state"],"17":["server.view-performance-state"]},
  "metadataPermissions":["server.view-any-definition"],
  "replicationPermissions":["replication.replmonitor"],
  "hostBinding":{"capability":"feature.host-binding","platform":"Windows","scope":"local-only"},
  "queryResources":{"supportedByMajor":{"15":"capability.connection.sqlserver15-windows.v3.sql","16":"capability.connection.sqlserver16-windows.v3.sql","17":"capability.connection.sqlserver17-windows.v3.sql"}},
  "fallback":{"mode":"unsupported"},"outputSchemaVersion":4
}
